[
  {
    "id": "faq_botox_1",
    "serviceId": "svc_botox",
    "questionKey": "faq.botox.q1",
    "answerKey": "faq.botox.a1"
  },
  {
    "id": "faq_botox_2",
    "serviceId": "svc_botox",
    "questionKey": "faq.botox.q2",
    "answerKey": "faq.botox.a2"
  },
  {
    "id": "faq_botox_3",
    "serviceId": "svc_botox",
    "questionKey": "faq.botox.q3",
    "answerKey": "faq.botox.a3"
  },
  {
    "id": "faq_botox_4",
    "serviceId": "svc_botox",
    "questionKey": "faq.botox.q4",
    "answerKey": "faq.botox.a4"
  },
  {
    "id": "faq_botox_5",
    "serviceId": "svc_botox",
    "questionKey": "faq.botox.q5",
    "answerKey": "faq.botox.a5"
  },
  {
    "id": "faq_botox_6",
    "serviceId": "svc_botox",
    "questionKey": "faq.botox.q6",
    "answerKey": "faq.botox.a6"
  },
  {
    "id": "faq_botox_7",
    "serviceId": "svc_botox",
    "questionKey": "faq.botox.q7",
    "answerKey": "faq.botox.a7"
  }
]
